<config
  xmlns="http://transparensee.com/schema/datatool-config-4"
  xmlns:xsi="http://www.w3.org/2001/XMLSchema-instance"
  xsi:schemaLocation=
    "http://transparensee.com/schema/datatool-config-4
     http://transparensee.com/schema/datatool-config-4.xsd">
  <!--
    Please see the Discovery Engine online documentation for complete details about configuring the Data Tool:
    https://transparensee.com/docs/discovery/current/html/data_integration/datatool.html
  -->
  <dataSources>
    <dataSource name="production-dataSource"
      jar="drivers/mysql-connector-java-5.1.10-bin.jar"
      class="com.mysql.jdbc.jdbc2.optional.MysqlDataSource">
      <url>jdbc:mysql://localhost/test</url>
      <user>test</user>
      <password>test</password>
    </dataSource>
  </dataSources>

  <profiles>
    <sqlProfile name="production-profile" dataSource="production-dataSource">
      <retrieveSql startColumn="start" endColumn="end">
        select last_run as start, CURRENT_TIMESTAMP as end
        from changeset_profile
        where name = :name
      </retrieveSql>
      <updateSql>
        update changeset_profile
        set last_run = :lastRun
        where name = :name
      </updateSql>
    </sqlProfile>
  </profiles>

  <publishers>
    <sqlPublisher name="production"
      dataSource="production-dataSource" profile="production-profile">
      <snapshot>
        <set-item idColumn="id">
          <query><![CDATA[
            select * from items
          ]]></query>
          <subquery><![CDATA[
            select name as color from SubqueryColors where parent_id=:id order by name
          ]]></subquery>
          <subquery property="color-array" type="array"><![CDATA[
            select name from SubqueryColors where parent_id=:id order by name
          ]]></subquery>
          <subquery property="color-delimited" type="delimited"><![CDATA[
            select name from SubqueryColors where parent_id=:id order by name
          ]]></subquery>
          <subquery property="color-delimited" type="delimited" delimiter="|"><![CDATA[
            select name from SubqueryColors where parent_id=:id order by name
          ]]></subquery>
          <subquery property="address" discriminator="addr_type"><![CDATA[
            select addr_type, street, city, state, zipcode from SubqueryAddress where parent_id=:id order by id
          ]]></subquery>
          <subquery propertyPrefix="product"><![CDATA[
            select id, price, description from order_lines where order_id=:id order by id
          ]]></subquery>
        </set-item>
      </snapshot>
      <delta>
        <set-item idColumn="id">
          <!--
          The following bound parameters are available to the query:
          :start - The inclusive start of the date range for this changeset as a java.util.Date.
          :end - The exclusive end of the date range for this changeset as a java.util.Date.
          :kind - "snapshot" or "delta"
           -->
          <query><![CDATA[
            select * from items
            where last_updated >= :start and last_updated < :end
          ]]></query>
          <subquery><![CDATA[
            select name as color from SubqueryColors where parent_id=:id order by name
          ]]></subquery>
          <subquery property="color-array" type="array"><![CDATA[
            select name from SubqueryColors where parent_id=:id order by name
          ]]></subquery>
          <subquery property="color-delimited" type="delimited"><![CDATA[
            select name from SubqueryColors where parent_id=:id order by name
          ]]></subquery>
          <subquery property="color-delimited" type="delimited" delimiter="|"><![CDATA[
            select name from SubqueryColors where parent_id=:id order by name
          ]]></subquery>
          <subquery property="address" discriminator="addr_type"><![CDATA[
            select addr_type, street, city, state, zipcode from SubqueryAddress where parent_id=:id order by id
          ]]></subquery>
          <subquery property="products"><![CDATA[
            select id, price, description from order_lines where order_id=:id order by id
          ]]></subquery>
        </set-item>
        <remove-item idColumn="id">
          <query><![CDATA[
            select id from deleted_items
            where last_updated >= :start and last_updated < :end
          ]]></query>
        </remove-item>
      </delta>
    </sqlPublisher>
  </publishers>
</config>
